{
  "schema_version": "1.0",
  "plan_id": "REINGEST_49496d868bd7",
  "plan_fingerprint": "49496d868bd741a4a01170745c11c434e8c008f35dceceb071ed3a41d7d55f3e",
  "candidate_snapshot": "2026-10-20",
  "promoted_at": "2026-10-20",
  "changed_sources": [
    "BSDATA_WH40K_11E",
    "WAHAPEDIA_11E"
  ],
  "auto_promote": false,
  "normative_mfm_changed": false,
  "copied_files": [
    "ingestion/promotions/REINGEST_49496d868bd7/candidate_evidence/official_assets.json",
    "ingestion/promotions/REINGEST_49496d868bd7/candidate_evidence/reconciliation.json",
    "ingestion/promotions/REINGEST_49496d868bd7/candidate_evidence/semantic_fingerprint_audit.json",
    "ingestion/promotions/REINGEST_49496d868bd7/candidate_evidence/view_diagnostics.json",
    "rules/11e/snapshots/2026-10-20/bsdata_fallback/index.json",
    "rules/11e/snapshots/2026-10-20/bsdata_fallback/titanicus_traitoris.json",
    "rules/11e/snapshots/2026-10-20/bsdata_fallback/unaligned_forces.json",
    "rules/11e/snapshots/2026-10-20/wahapedia/ability_catalog.json",
    "rules/11e/snapshots/2026-10-20/wahapedia/factions/adepta_sororitas.json",
    "rules/11e/snapshots/2026-10-20/wahapedia/factions/adeptus_custodes.json",
    "rules/11e/snapshots/2026-10-20/wahapedia/factions/adeptus_mechanicus.json",
    "rules/11e/snapshots/2026-10-20/wahapedia/factions/adeptus_titanicus.json",
    "rules/11e/snapshots/2026-10-20/wahapedia/factions/aeldari_craftworlds.json",
    "rules/11e/snapshots/2026-10-20/wahapedia/factions/agents_of_the_imperium.json",
    "rules/11e/snapshots/2026-10-20/wahapedia/factions/astra_militarum.json",
    "rules/11e/snapshots/2026-10-20/wahapedia/factions/chaos_daemons.json",
    "rules/11e/snapshots/2026-10-20/wahapedia/factions/chaos_knights.json",
    "rules/11e/snapshots/2026-10-20/wahapedia/factions/chaos_space_marines.json",
    "rules/11e/snapshots/2026-10-20/wahapedia/factions/death_guard.json",
    "rules/11e/snapshots/2026-10-20/wahapedia/factions/drukhari.json",
    "rules/11e/snapshots/2026-10-20/wahapedia/factions/emperors_children.json",
    "rules/11e/snapshots/2026-10-20/wahapedia/factions/genestealer_cults.json",
    "rules/11e/snapshots/2026-10-20/wahapedia/factions/grey_knights.json",
    "rules/11e/snapshots/2026-10-20/wahapedia/factions/imperial_knights.json",
    "rules/11e/snapshots/2026-10-20/wahapedia/factions/leagues_of_votann.json",
    "rules/11e/snapshots/2026-10-20/wahapedia/factions/necrons.json",
    "rules/11e/snapshots/2026-10-20/wahapedia/factions/orks.json",
    "rules/11e/snapshots/2026-10-20/wahapedia/factions/space_marines.json",
    "rules/11e/snapshots/2026-10-20/wahapedia/factions/tau_empire.json",
    "rules/11e/snapshots/2026-10-20/wahapedia/factions/thousand_sons.json",
    "rules/11e/snapshots/2026-10-20/wahapedia/factions/tyranids.json",
    "rules/11e/snapshots/2026-10-20/wahapedia/factions/unbound-adversaries.json",
    "rules/11e/snapshots/2026-10-20/wahapedia/factions/world_eaters.json",
    "rules/11e/snapshots/2026-10-20/wahapedia/manifest.json",
    "rules/11e/snapshots/2026-10-20/wahapedia/roster_views/adepta_sororitas.json",
    "rules/11e/snapshots/2026-10-20/wahapedia/roster_views/adeptus_custodes.json",
    "rules/11e/snapshots/2026-10-20/wahapedia/roster_views/adeptus_mechanicus.json",
    "rules/11e/snapshots/2026-10-20/wahapedia/roster_views/adeptus_titanicus.json",
    "rules/11e/snapshots/2026-10-20/wahapedia/roster_views/aeldari_craftworlds.json",
    "rules/11e/snapshots/2026-10-20/wahapedia/roster_views/agents_of_the_imperium.json",
    "rules/11e/snapshots/2026-10-20/wahapedia/roster_views/astra_militarum.json",
    "rules/11e/snapshots/2026-10-20/wahapedia/roster_views/black_templars.json",
    "rules/11e/snapshots/2026-10-20/wahapedia/roster_views/blood_angels.json",
    "rules/11e/snapshots/2026-10-20/wahapedia/roster_views/chaos_daemons.json",
    "rules/11e/snapshots/2026-10-20/wahapedia/roster_views/chaos_knights.json",
    "rules/11e/snapshots/2026-10-20/wahapedia/roster_views/chaos_space_marines.json",
    "rules/11e/snapshots/2026-10-20/wahapedia/roster_views/dark_angels.json",
    "rules/11e/snapshots/2026-10-20/wahapedia/roster_views/death_guard.json",
    "rules/11e/snapshots/2026-10-20/wahapedia/roster_views/deathwatch.json",
    "rules/11e/snapshots/2026-10-20/wahapedia/roster_views/drukhari.json",
    "rules/11e/snapshots/2026-10-20/wahapedia/roster_views/emperors_children.json",
    "rules/11e/snapshots/2026-10-20/wahapedia/roster_views/genestealer_cults.json",
    "rules/11e/snapshots/2026-10-20/wahapedia/roster_views/grey_knights.json",
    "rules/11e/snapshots/2026-10-20/wahapedia/roster_views/imperial_fists.json",
    "rules/11e/snapshots/2026-10-20/wahapedia/roster_views/imperial_knights.json",
    "rules/11e/snapshots/2026-10-20/wahapedia/roster_views/index.json",
    "rules/11e/snapshots/2026-10-20/wahapedia/roster_views/iron_hands.json",
    "rules/11e/snapshots/2026-10-20/wahapedia/roster_views/leagues_of_votann.json",
    "rules/11e/snapshots/2026-10-20/wahapedia/roster_views/necrons.json",
    "rules/11e/snapshots/2026-10-20/wahapedia/roster_views/orks.json",
    "rules/11e/snapshots/2026-10-20/wahapedia/roster_views/raven_guard.json",
    "rules/11e/snapshots/2026-10-20/wahapedia/roster_views/salamanders.json",
    "rules/11e/snapshots/2026-10-20/wahapedia/roster_views/space_marines.json",
    "rules/11e/snapshots/2026-10-20/wahapedia/roster_views/space_wolves.json",
    "rules/11e/snapshots/2026-10-20/wahapedia/roster_views/tau_empire.json",
    "rules/11e/snapshots/2026-10-20/wahapedia/roster_views/thousand_sons.json",
    "rules/11e/snapshots/2026-10-20/wahapedia/roster_views/tyranids.json",
    "rules/11e/snapshots/2026-10-20/wahapedia/roster_views/ultramarines.json",
    "rules/11e/snapshots/2026-10-20/wahapedia/roster_views/white_scars.json",
    "rules/11e/snapshots/2026-10-20/wahapedia/roster_views/world_eaters.json",
    "rules/11e/snapshots/2026-10-20/wahapedia/source_catalog.json"
  ],
  "pointer_updates": [
    "rules/11e/current.json:wave_b_structural",
    "rules/11e/current.json:semantic_resolver",
    "coverage/current.json:wave_b_current_mirror",
    "sources/registry.json:WAHAPEDIA_11E",
    "sources/currentness_gate.json:WAHAPEDIA_11E",
    "rules/11e/current.json:implementation_fallback_snapshot",
    "coverage/current.json:implementation_fallback",
    "sources/registry.json:BSDATA_WH40K_11E",
    "sources/currentness_gate.json:BSDATA_WH40K_11E"
  ]
}
